{"artifacts":[{"id":"system","index":0,"path":"images/system.img","sha256":"1111111111111111111111111111111111111111111111111111111111111111"}],"kind":"FlashJob","manifestApiVersion":"kairosboot.io/v1","manifestSha256":"58539b1d8a0ba3108ffd0f0ea835d25efca9a6ce85b06cd15f0f1307d4b1c9ef","policy":{"maxParallelDevices":32,"memoryBudget":"auto","onDeviceFailure":"continue"},"schemaVersion":1,"targets":[{"expectedProduct":"product_a","index":0,"name":"product-a","selector":{"serials":["SERIAL-01","SERIAL-02"],"usbPaths":[]},"steps":[{"artifact":"system","index":0,"oemCommand":null,"operation":"flash","partition":"system","rebootTarget":null,"slot":null}]}]}
